{
  "schemaVersion": 1,
  "sourceSha": "5694bdbd04d7754e0df8c523786a6a8ee95a246b",
  "trialStatus": "passed",
  "complete": true,
  "droppedEvents": 0,
  "observationWindowEndNanos": 20000000,
  "events": [
    {
      "sequence": 0,
      "domain": "main:terrain",
      "key": {
        "worldEpoch": 1,
        "sectionId": 42,
        "geometryRevision": 3,
        "lightingRevision": 5,
        "materialGeneration": 2
      },
      "stage": "DATA_READY",
      "monotonicNanos": 100,
      "bytes": 0,
      "reason": "fixture",
      "frameId": null,
      "meshGeneration": null,
      "drawExpected": true
    },
    {
      "sequence": 1,
      "domain": "main:terrain",
      "key": {
        "worldEpoch": 1,
        "sectionId": 42,
        "geometryRevision": 3,
        "lightingRevision": 5,
        "materialGeneration": 2
      },
      "stage": "BUILD_START",
      "monotonicNanos": 120,
      "bytes": 0,
      "reason": "fixture",
      "frameId": null,
      "meshGeneration": null,
      "drawExpected": true
    },
    {
      "sequence": 2,
      "domain": "main:terrain",
      "key": {
        "worldEpoch": 1,
        "sectionId": 42,
        "geometryRevision": 3,
        "lightingRevision": 5,
        "materialGeneration": 2
      },
      "stage": "BUILD_END",
      "monotonicNanos": 150,
      "bytes": 0,
      "reason": "fixture",
      "frameId": null,
      "meshGeneration": null,
      "drawExpected": true
    },
    {
      "sequence": 3,
      "domain": "main:terrain",
      "key": {
        "worldEpoch": 1,
        "sectionId": 42,
        "geometryRevision": 3,
        "lightingRevision": 5,
        "materialGeneration": 2
      },
      "stage": "PUBLISHED",
      "monotonicNanos": 170,
      "bytes": 0,
      "reason": "fixture",
      "frameId": null,
      "meshGeneration": 7,
      "drawExpected": true
    },
    {
      "sequence": 4,
      "domain": "main:terrain",
      "key": {
        "worldEpoch": 2,
        "sectionId": 42,
        "geometryRevision": 3,
        "lightingRevision": 5,
        "materialGeneration": 2
      },
      "stage": "FIRST_VALID_DRAW",
      "monotonicNanos": 200,
      "bytes": 0,
      "reason": "fixture",
      "frameId": 10,
      "meshGeneration": 7,
      "drawExpected": true
    }
  ]
}
